<?xml version="1.0" encoding="UTF-8"?>
<?xml-stylesheet type="text/xsl" href="products.xsl"?>
<!DOCTYPE products SYSTEM "products.dtd">

<!--TO-DO:
	- Fix the horrible layout
	- Add info, or remove, and subsequently edit dtd
-->

<products>
	<medicines>
		<medicine>
			<thumbnail>
				thumbnail_1.png
			</thumbnail>
			<name>
				name 1
			</name>
			<description>
				description 1
			</description>
			<ingredients>
				<ingredient>
					ingredient 1 1
				</ingredient>
				<ingredient>
					ingredient 1 2
				</ingredient>
				<ingredient>
					ingredient 1 3
				</ingredient>
				<ingredient>
					ingredient 1 4
				</ingredient>
			</ingredients>
			<method_of_administration>
				<Oral/>
			</method_of_administration>
			<dosage>
				dosage 1
			</dosage>
			<price>
				price 1
			</price>
			<in_stock
				><no/>
			</in_stock>
			<manufacturer>
				manufacturer 1
			</manufacturer>
			<type>
				<drugs/>
			</type>
		</medicine>
		<medicine>
			<thumbnail>
				thumbnail_1.png
			</thumbnail>
			<name>
				name 1
			</name>
			<description>
				description 1
			</description>
			<ingredients>
				<ingredient>
					ingredient 1 1
				</ingredient>
				<ingredient>
					ingredient 1 2
				</ingredient>
				<ingredient>
					ingredient 1 3
				</ingredient>
				<ingredient>
					ingredient 1 4
				</ingredient>
			</ingredients>
			<method_of_administration>
				<Oral/>
			</method_of_administration>
			<dosage>
				dosage 1
			</dosage>
			<price>
				price 1
			</price>
			<in_stock
				><no/>
			</in_stock>
			<manufacturer>
				manufacturer 1
			</manufacturer>
			<type>
				<drugs/>
			</type>
		</medicine>
		<medicine>
			<thumbnail>
				thumbnail_1.png
			</thumbnail>
			<name>
				name 1
			</name>
			<description>
				description 1
			</description>
			<ingredients>
				<ingredient>
					ingredient 1 1
				</ingredient>
				<ingredient>
					ingredient 1 2
				</ingredient>
				<ingredient>
					ingredient 1 3
				</ingredient>
				<ingredient>
					ingredient 1 4
				</ingredient>
			</ingredients>
			<method_of_administration>
				<Oral/>
			</method_of_administration>
			<dosage>
				dosage 1
			</dosage>
			<price>
				price 1
			</price>
			<in_stock
				><no/>
			</in_stock>
			<manufacturer>
				manufacturer 1
			</manufacturer>
			<type>
				<drugs/>
			</type>
		</medicine>
	</medicines>

	<medical_devices>
		<medical_device>
			<thumbnail>
				thumbnail_1.png
			</thumbnail>
			<name>
				name 1
			</name>
			<description>
				description 1
			</description>
			<price>
				price 1
			</price>
			<in_stock>
				<no/>
			</in_stock>
			<manufacturer>
				manufacturer 1
			</manufacturer>
		</medical_device>
		<medical_device>
			<thumbnail>
				thumbnail_1.png
			</thumbnail>
			<name>
				name 1
			</name>
			<description>
				description 1
			</description>
			<price>
				price 1
			</price>
			<in_stock>
				<no/>
			</in_stock>
			<manufacturer>
				manufacturer 1
			</manufacturer>
		</medical_device>
		<medical_device>
			<thumbnail>
				thumbnail_1.png
			</thumbnail>
			<name>
				name 1
			</name>
			<description>
				description 1
			</description>
			<price>
				price 1
			</price>
			<in_stock>
				<no/>
			</in_stock>
			<manufacturer>
				manufacturer 1
			</manufacturer>
		</medical_device>
	</medical_devices>

	<others>
		<other>
			<thumbnail>
				thumbnail_1.png
			</thumbnail>
			<name>
				name 1
			</name>
			<description>
				description 1
			</description>
			<ingredients>
				<ingredient>
					ingredient 1 1
				</ingredient>
				<ingredient>
					ingredient 1 2
				</ingredient>
				<ingredient>
					ingredient 1 3
				</ingredient>
				<ingredient>
					ingredient 1 4
				</ingredient>
			</ingredients>
			<method_of_administration>
				<Oral/>
			</method_of_administration>
			<dosage>
				dosage 1
			</dosage>
			<price>
				price 1
			</price>
			<in_stock
				><no/>
			</in_stock>
			<manufacturer>
				manufacturer 1
			</manufacturer>
			<type>
				<drugs/>
			</type>
		</other>
		<other>
			<thumbnail>
				thumbnail_1.png
			</thumbnail>
			<name>
				name 1
			</name>
			<description>
				description 1
			</description>
			<ingredients>
				<ingredient>
					ingredient 1 1
				</ingredient>
				<ingredient>
					ingredient 1 2
				</ingredient>
				<ingredient>
					ingredient 1 3
				</ingredient>
				<ingredient>
					ingredient 1 4
				</ingredient>
			</ingredients>
			<method_of_administration>
				<Oral/>
			</method_of_administration>
			<dosage>
				dosage 1
			</dosage>
			<price>
				price 1
			</price>
			<in_stock
				><no/>
			</in_stock>
			<manufacturer>
				manufacturer 1
			</manufacturer>
			<type>
				<drugs/>
			</type>
		</other>
		<other>
			<thumbnail>
				thumbnail_1.png
			</thumbnail>
			<name>
				name 1
			</name>
			<description>
				description 1
			</description>
			<ingredients>
				<ingredient>
					ingredient 1 1
				</ingredient>
				<ingredient>
					ingredient 1 2
				</ingredient>
				<ingredient>
					ingredient 1 3
				</ingredient>
				<ingredient>
					ingredient 1 4
				</ingredient>
			</ingredients>
			<method_of_administration>
				<Oral/>
			</method_of_administration>
			<dosage>
				dosage 1
			</dosage>
			<price>
				price 1
			</price>
			<in_stock
				><no/>
			</in_stock>
			<manufacturer>
				manufacturer 1
			</manufacturer>
			<type>
				<drugs/>
			</type>
		</other>
		<other>
			<thumbnail>
				thumbnail_1.png
			</thumbnail>
			<name>
				name 1
			</name>
			<description>
				description 1
			</description>
			<ingredients>
				<ingredient>
					ingredient 1 1
				</ingredient>
				<ingredient>
					ingredient 1 2
				</ingredient>
				<ingredient>
					ingredient 1 3
				</ingredient>
				<ingredient>
					ingredient 1 4
				</ingredient>
			</ingredients>
			<method_of_administration>
				<Oral/>
			</method_of_administration>
			<dosage>
				dosage 1
			</dosage>
			<price>
				price 1
			</price>
			<in_stock
				><no/>
			</in_stock>
			<manufacturer>
				manufacturer 1
			</manufacturer>
			<type>
				<drugs/>
			</type>
		</other>
	</others>
</products>
